{"configurationId": "cfg_01K0ABCDEFGHJKMNPQRSTVWXYZ", "roomId": "room_01K0ABCDEFGHJKMNPQRSTVWXYZ", "revision": 1, "schemaVersion": "1.0", "desiredState": {"startupPresetId": "holding-default", "holdingEnabled": true}, "adapters": [{"adapterType": "touchdesigner", "configuration": {"projectReleaseId": "release_touchdesigner_phase1"}}, {"adapterType": "system_health", "configuration": {"heartbeatIntervalSeconds": 20}}], "presets": [{"presetId": "holding-default", "name": "Default holding state", "actions": [{"action": "holding.show", "parameters": {"assetId": "asset_holding_default"}, "assetId": "asset_holding_default"}, {"action": "audio.microphones.setMuted", "parameters": {"muted": true}}]}, {"presetId": "presentation", "name": "Presentation", "actions": [{"action": "holding.hide", "parameters": {}}, {"action": "video.output.selectSource", "parameters": {"sourceId": "presentation"}}, {"action": "audio.microphones.setMuted", "parameters": {"muted": false}}]}], "assets": [{"assetId": "asset_holding_default", "kind": "image"}]}
